{
    "task_id": "TASK-0001",
    "work_item_revision": 1,
    "artifact_attempt": 1,
    "implementer_session_id": "session-20260813-usage-manual-root",
    "reviewer_session_id": "session-20260813-usage-manual-root",
    "handoff_path": "reviews/r001/handoff-001.json",
    "handoff_sha256": "56cfeb732c89db47d82ac0a324b3cb7b3f07554f6109864ed0846115d8c4ba90",
    "isolation_attestation": {
        "mode": "r0_isolated_same_session",
        "chat_history_inherited": true,
        "reviewed_from_handoff_only": true
    },
    "supersedes_review": null,
    "subject_base_commit": "3c86b5335d531b662e127bb5da6d8b442bf75af0",
    "subject_head_commit": "7e10dae772c07c03c29ea122d4e80a1e18d31262",
    "subject_diff_hash": "f8da6ed86a18043f59f80383eefe6a376b14103658d1f1afa1e0aa4e8b52237a",
    "reviewed_at": "2026-08-13T14:47:15.2921371Z",
    "verdict": "ACCEPT",
    "findings": []
}
